{
  "schema_version": 1,
  "request_id": "11111111-1111-4111-8111-111111111111",
  "connection_id": "synthetic-dev",
  "operation": "SELECT",
  "task": {
    "purpose": "verify-test",
    "correlation": "test:synthetic-order",
    "description": "Compare the explicit synthetic order expectation"
  },
  "parameters": [
    {
      "name": "@id",
      "type": "int",
      "value": 42
    }
  ],
  "sql": "SELECT OrderId, Status FROM dbo.Orders WHERE OrderId = @id"
}
