{
  "schema_version": 1,
  "request_id": "11111111-1111-4111-8111-111111111111",
  "connection_id": "synthetic-dev",
  "operation": "UPDATE",
  "task": {
    "purpose": "modify",
    "correlation": "issue:synthetic",
    "description": "Explicitly requested synthetic update"
  },
  "parameters": [
    {
      "name": "@id",
      "type": "int",
      "value": 42
    },
    {
      "name": "@old",
      "type": "nvarchar",
      "size": 40,
      "value": "Pending"
    },
    {
      "name": "@new",
      "type": "nvarchar",
      "size": 40,
      "value": "Completed"
    }
  ],
  "write": {
    "schema": "dbo",
    "table": "Orders",
    "keys": [
      {
        "column": "OrderId",
        "parameter": "@id"
      }
    ],
    "expected": [
      {
        "column": "Status",
        "parameter": "@old"
      }
    ],
    "set": [
      {
        "column": "Status",
        "parameter": "@new"
      }
    ],
    "max_affected_rows": 1
  }
}
